comment,category,score,reason,suggestion
shortcut behind the rec center solid,location/geoinformation,6,"The comment ""shortcut behind the rec center solid"" violates the location/geoinformation type because it reveals the location of a public facility. This information can be used by criminals to plan their activities and locate potential targets. To protect one's privacy, it is recommended to avoid posting sensitive information about public places.","To avoid revealing one's location, it is recommended to use a private or encrypted messaging app instead of posting publicly visible information. Additionally, it is essential to be mindful of the privacy settings of public facilities and avoid posting sensitive information that could be used to identify individuals."
i recognize the crosswalk near my uni,location/geoinformation,6,"The comment ""i recognize the crosswalk near my uni"" violates the ""location/geoinformation"" violation type because it reveals the user's location, which is a privacy concern. The specific risk is that the comment could be used to track the user's movements or location.","To protect the user's privacy, the comment should be edited to remove any location information or replace it with a generic phrase like ""at the crosswalk near my uni."" This will prevent the comment from violating the ""location/geoinformation"" violation type and ensure that the user's location is not revealed."
spot where the team eats after a win,routines,6,"The comment violates the ""routines"" violation type because it suggests that the user eats at a particular restaurant after a win. This information could potentially reveal the team's location or other private information. To protect the user's privacy, the suggestion could be to avoid mentioning specific restaurants or eating places.","Instead of mentioning specific restaurants, the user could say something like, ""After the win, we decided to grab dinner at a nearby restaurant that we've been wanting to try."" This suggestion would help protect the user's privacy while still providing a safe and enjoyable dining experience."
see that statue on my run route lol,routines,5,"The comment ""see that statue on my run route lol"" violates the ""routines"" violation type because it reveals personal information about the user's running route. The specific risk is that the comment could lead to the user's personal information being shared with others, which could compromise his privacy.","To protect his privacy, the user should avoid sharing personal information about his running route on social media platforms. He should consider using a different social media platform or disabling the ""routines"" violation type."
my balcony view looks just like this,location/geoinformation,8,The comment violates the location/geoinformation violation type because it suggests that the user's balcony view looks like a public park or a public garden. This could potentially expose the user's location and potentially compromise his privacy.,"To protect his privacy, the user should avoid posting comments that suggest his balcony view looks like a public park or a public garden. He should instead focus on posting comments that showcase his personal view of his balcony or the surrounding area."
our hangout under the big oak still classic,location/geoinformation,6,"The comment violates the location/geoinformation violation type because it contains information about the user's physical location, which can be used by third parties to track their movements and behavior. To be safe, the user should avoid posting such information in public forums or social media platforms.","To protect their privacy, the user should consider posting their location information only when they are physically present in a specific location or when it is necessary for a specific purpose, such as attending a meeting or event. They should also consider using location-based privacy settings on their social media accounts to limit the amount of information that is shared with third parties."
parked my bike here this morning too,routines,7,"The comment ""parked my bike here this morning too"" violates the ""routines"" violation type because it reveals personal information about the user's bike, such as the make, model, and color. This information can be used by unauthorized individuals to steal or damage the bike.","To protect the user's privacy, the comment should be edited to remove any personal information or replaced with a generic statement like ""I parked my bike at the designated parking spot this morning."" This will prevent others from accessing the user's personal information and potentially causing damage to their bike."
study sesh spot after chem lab,routines,5,"- The comment mentions a study session after chemistry lab, which is a routine activity that can expose personal information to others. This can potentially violate the user's privacy and may cause embarrassment or stress.","- If the user is concerned about privacy, he can consider using a different study session location or routine, such as a quiet room or a library, to avoid exposing personal information to others. He can also consider using a different routine, such as a walk outside or a quiet activity, to avoid exposing personal information to others."
locker hallway flashback again haha,routines,6,"The comment highlights the potential privacy concern of sharing a locker hallway with other students, as it could be seen by anyone walking by. To avoid this risk, the user should avoid using the locker hallway during class hours or during other times when it's not being used by other students.","To protect their privacy, the user should consider using a different locker or finding a different location to store their belongings. They could also consider using a different hallway or a different part of the school if possible."
wait is that the field by 9th street?,location/geoinformation,6,"The comment ""Wait is that the field by 9th street?"" violates the ""location/geoinformation"" violation type. The reason for this violation is that the comment contains information about a specific location, which could potentially reveal the user's location.","To protect the user's privacy, the comment should be edited to remove any information about the location. For example, the comment could be changed to ""The field is located near 9th Street."" This would ensure that the location information is removed from the comment."
pretty sure that's my neighborhood lol,location/geoinformation,7,"The comment ""pretty sure that's my neighborhood lol"" violates the ""location/geoinformation"" violation type because it reveals the user's actual location, which can be a privacy concern. The comment ""lol"" is also a violation because it contains a derogatory term that can be offensive to some people.",The user should avoid posting comments that reveal his actual location or contain offensive language. He should also consider using a pseudonym or a different username to protect his privacy.
see that light pole from my room lmao,location/geoinformation,7,"The comment ""see that light pole from my room lmao"" violates the location/geoinformation violation type because it reveals the physical location of a user's room. This information can be used to identify the user and potentially compromise their privacy. Suggestion: To protect your privacy, you should avoid posting comments that reveal your physical location, such as ""I'm at work"" or ""I'm at home.""","To protect your privacy, you should avoid posting comments that reveal your physical location, such as ""I'm at work"" or ""I'm at home."""
late night boba at this plaza always,routines,5,"The comment ""late night boba at this plaza always"" violates the ""routines"" type because it reveals personal information such as the user's location and routines. The comment could be made more safe by using a hashtag or a location-based filter to hide the user's location, or by using a privacy-enhancing tool like a VPN or a proxy to protect the user's privacy.","If the user wants to avoid revealing their location or routines, he can use a VPN or a proxy to hide his online activity. He can also consider using a privacy-enhancing tool like a VPN or a proxy to protect his privacy. Additionally, he can consider using a location-based filter to hide his location, or he can choose to not post his location at all."
this the ice rink by my house?,location/geoinformation,7,"The comment ""this the ice rink by my house?"" violates the location/geoinformation violation type because it reveals the user's location, which is a privacy concern. The comment could be made more secure by using a geolocation API or by using a different location-based feature.","To protect the user's privacy, the comment could be made with a placeholder for the user's location, such as ""this ice rink near my house."" Alternatively, the comment could be made with a link to a privacy policy or a disclaimer that states that the user's location is not shared with third parties."
meet me at the old fountain after art class,routines,6,"The comment ""meet me at the old fountain after art class"" violates the ""routines"" type because it reveals personal information about the user's location. The comment could be made more private by using a different location or by using a location-based service like Google Maps or Waze.","To avoid this violation, the user should consider using a location-based service like Google Maps or Waze to find the old fountain after art class. This will ensure that their location is not revealed to others."
walked past here on my way to work today,routines,6,"The comment ""walked past here on my way to work today"" violates the ""routines"" type because it reveals personal information about the user's daily routine. The risk associated with this violation is that the user's personal information could be accessed by unauthorized individuals.","To protect one's privacy, the user should avoid sharing personal information in public places, such as on social media. He should also consider using a private messaging app or setting up a privacy-enhancing browser extension to protect his online activities."
always see your stories at this corner,location/geoinformation,4,"The comment violates the location/geoinformation violation type because it suggests that the user's stories are being viewed at a specific location, which could potentially reveal their location to others. Focus on the specific risk of this violation type, which is that the user's privacy could be compromised.","To protect their privacy, the user should avoid posting their stories at this corner or any other location where they might be easily visible to others. They could consider posting their stories elsewhere, such as in a more secluded area or using a pseudonym."
lol library cubicle squad at it again,routines,5,"The comment ""lol library cubicle squad at it again"" violates the ""routines"" type because it reveals personal information about the user's workplace, which can be a privacy concern. The comment could be made safer by not sharing sensitive information in public spaces, such as libraries or cubicles.","To protect your privacy, avoid sharing personal information in public spaces, such as libraries or cubicles. You could also consider using a different workplace or location for your comment to avoid any potential privacy concerns."
same spot where bus 33 picks me up,routines,7,"The comment violates the ""routines"" violation type due to the fact that it refers to a specific location, which can be easily identified by the user. This information can be used to track the user's movements and potentially compromise his privacy.","To avoid this risk, the user should avoid posting comments that refer to specific locations or places where he is known to be. He should also consider using a different location for his comments, such as a public space or a generic location."
isnâ€™t this the west campus parking lot?,location/geoinformation,6,A single short sentence explaining why the comment violates the type. Focus on the specific risk and privacy concern. - Suggestion: A single short sentence suggesting how the comment could be safer or what the user should avoid to protect his privacy.,A single short sentence suggesting how the comment could be safer or what the user should avoid to protect his privacy.
past this playground all through elementary,routines,6,"The comment ""past this playground all through elementary"" violates the ""routines"" type because it reveals personal information about the user's location. The user's location is sensitive information that should be protected, and revealing it in a public forum could lead to identity theft or other privacy concerns.","To protect the user's privacy, the comment should be edited to remove any information about the user's location. The user should consider using a different forum or platform that doesn't publicly display their location."
daily stop at this coffee hut on the way in,routines,6,"The comment ""daily stop at this coffee hut on the way in"" violates the ""routines"" type because it reveals personal information about the user's daily routine. The comment is a potential privacy violation as it could reveal the user's location, which could be used by others to track his movements. To suggest a safer alternative, the comment could be reworded to say ""stop at this coffee hut on the way in"" or ""make a quick stop at this coffee hut on the way in.""","Instead of ""daily stop at this coffee hut on the way in,"" the comment could be reworded to say ""make a quick stop at this coffee shop on the way in"" or ""stop at this coffee shop on the way in."" This would suggest that the user is only stopping for a quick cup of coffee and not making a longer stop. This would help to protect the user's privacy and prevent any potential privacy breaches."
u always chill here after PE period,routines,5,"The comment ""u always chill here after PE period"" violates the ""routines"" violation type because it reveals personal information about the user's daily activities, such as where they go to school or work. This information can be easily accessible to others and can potentially compromise their privacy.","To protect their privacy, the user should avoid sharing personal information about their daily activities on social media platforms. They should consider using a different platform or disclosing less sensitive information in their posts."
recognize that roof from my walk,location/geoinformation,6,"The comment includes a reference to a specific location, which could potentially reveal the user's physical location. This violates the ""location/geoinformation"" violation type and raises concerns about privacy.","To protect the user's privacy, the comment should be edited to remove any reference to the user's physical location. This could be done by replacing the location-related information with generic terms such as ""my house"" or ""my neighborhood."""
same shortcut for my late night walks,routines,5,"The comment ""same shortcut for my late night walks"" violates the ""routines"" type because it suggests that the user is sharing personal information with others. The comment could be made safer by using a different shortcut, such as a different route or a different time of day.","Instead of sharing personal information, the user could use a different shortcut or time of day to avoid being tracked by others. For example, he could use a different route or time of day to avoid being seen by pedestrians or cyclists."
my old office right above that bar,location/geoinformation,7,"The comment ""my old office right above that bar"" violates the location/geoinformation type because it reveals the physical location of the user's workplace, which can be a privacy concern. The comment could be made more secure by using a different location identifier, such as the building number or street name.","To protect the user's privacy, the comment could be reworded to say something like ""I used to work in the building next to that bar, but now I'm at a new office in a different location."" This would suggest that the user is no longer in the same physical location as the comment was made, which could help reduce the risk of the comment being misinterpreted as a location-based threat."
corner booth at this diner is my spot,location/geoinformation,6,"The mention of a corner booth at a diner is a privacy concern as it could reveal personal information such as the user's name, address, and phone number. To avoid this risk, the user should avoid posting this information in public spaces like social media.","To protect his privacy, the user should consider posting his information in a private and secure location, such as his email or a secure messaging app. He should also consider using a pseudonym or anonymizing his information if necessary."
hit up the corner store after classes too,routines,5,"The comment violates the ""routines"" violation type because it suggests that the user will be going to a specific location after classes, which is a privacy concern. Focus on the specific risk associated with this violation type: ""The comment suggests that the user will be going to a specific location after classes, which is a privacy concern.""","To protect the user's privacy, the comment should be modified to avoid mentioning specific locations or times after classes. Instead, the comment could suggest that the user will be going to a nearby location or to a time that is not after classes. For example, ""Hit up the coffee shop after class, or head to a nearby park if you're feeling adventurous."""
where we used to line up for assemblies,routines,5,"The comment ""where we used to line up for assemblies"" violates the ""routines"" violation type because it reveals personal information about the user's past activities. This information could be used to identify them and potentially compromise their privacy.","The comment could be reworded to ""we used to line up for assemblies in the past,"" which would avoid revealing personal information and make it more clear that the comment is not about the current situation."
always meet up here for robotics club,routines,5,"The comment ""always meet up here for robotics club"" violates the ""routines"" violation type because it reveals the location of the club, which is a private place where people can meet and interact. This information can be used by hackers or other malicious actors to locate the club and potentially compromise its security. Suggestion: Instead of meeting up at the club, consider meeting up at a different location that is not visible from public view. This will help to protect the privacy of the club and its members.","Instead of meeting up at the club, consider meeting up at a different location that is not visible from public view. This will help to protect the privacy of the club and its members."
pass the mural on the way to my grandma's,routines,5,"The comment ""pass the mural on the way to my grandma's"" violates the ""routines"" type because it contains information about the user's location, which is not typically shared with others. The comment could be made safer by using a location-sharing app or disclosing the user's location only when necessary, such as when they are in a public place or when they explicitly ask to share their location.","The user should avoid sharing their location in comments that could potentially reveal their location to others, such as when they are in a public place or when they explicitly ask to share their location. They could consider using a location-sharing app or disclosing their location only when necessary."
my jog takes me here every morning,routines,7,"The comment ""my jog takes me here every morning"" violates the ""routines"" type because it reveals personal information about the user's daily routine. The comment is a clear violation of the user's privacy as it reveals their location, which could be used for spying or harassment.","To protect the user's privacy, they should avoid sharing their location in public places or posting their daily routine on social media. They can also consider using a location-based app to track their daily routine without revealing their exact location."
family eats here every sunday,routines,6,"The comment ""routines"" violates the type of ""location/geoinformation"" because it reveals the user's location, which is a privacy concern. The comment ""family eats here every sunday"" violates the type of ""contactinfo"" because it contains personal information, which is also a privacy concern.","To make the comment safer and avoid privacy concerns, the user should avoid sharing personal information in public places or while eating out. They should also consider using a private dining option or ordering takeout instead."
yo thatâ€™s the alley behind smithâ€™s market?,location/geoinformation,6,"The comment ""yo thatâ€™s the alley behind smithâ€™s market?"" violates the type ""location/geoinformation"" due to the potential risk of revealing the user's location or other personal information. The comment suggests avoiding this location or taking precautions to protect one's privacy.","If the user is concerned about their privacy, they should avoid posting comments that reveal their location or other personal information in public spaces. They can consider using a private messaging app or other privacy-focused tools to communicate with others."
u really catching sunsets from my porch huh,location/geoinformation,8,"The comment ""u really catching sunsets from my porch huh"" violates the ""location/geoinformation"" violation type because it reveals the location of the user's home. The comment could be interpreted as a request for someone to take a photo of the user's home, which could potentially reveal their private address or other personal information.","To protect the user's privacy, the comment should be edited to remove any mention of their home address or other personal information. The user should be encouraged to use privacy-focused social media platforms or other tools that prioritize privacy and security."
library steps again right after my noon class,routines,6,"The comment ""library steps again right after my noon class"" violates the ""routines"" type because it reveals the user's location and activity during a specific time period. The risk associated with this type of violation is that it can compromise the user's privacy and security.","To protect the user's privacy, the comment should be edited to remove any identifying information, such as the user's name or location. The user should also consider taking a different route or avoiding public places during the same time period."
morning run ends at this traffic light,routines,6,"The comment violates the ""routines"" violation type because it includes information about the user's location, which can be a privacy concern. The comment should be flagged with a risk score of 6, indicating a high risk of privacy violation.","To protect the user's privacy, the comment should be edited to remove any information about the user's location. The user should be warned that the comment may be flagged as violating the ""routines"" violation type and should be cautious about sharing sensitive information in the future."
Ice cream truck passes here every friday,routines,6,"- The comment mentions a specific location, which could potentially reveal the user's location to the truck driver. This could potentially violate the user's privacy.","- To protect the user's privacy, the comment should be edited to avoid mentioning specific locations or contact information. Instead, the comment could be phrased as ""I enjoy the ice cream truck's music on Fridays"" or ""I appreciate the convenience of the ice cream truck's location"". - The user should also consider using a different location or contact information in the future to avoid violating the risk score."
bumped into u at this cafe last week,location/geoinformation,5,"The comment ""bumped into u at this cafe last week"" violates the ""location/geoinformation"" violation type due to the potential for the comment to reveal the user's physical location. The comment could potentially reveal the user's exact location to other users, which could be a privacy concern.","To protect the user's privacy, the comment should be edited to remove any mention of the user's physical location, such as ""bumped into someone at this cafe last week."" This would help to avoid any potential violations of the ""location/geoinformation"" violation type."
is that the food court with the yellow sign?,location/geoinformation,5,A single short sentence explaining why the comment violates the type. Focus on the specific risk and privacy concern.,A single short sentence suggesting how the comment could be safer or what the user should avoid to protect his privacy.
picnic here every summer break,routines,6,"The comment ""picnic here every summer break"" violates the ""routines"" type because it reveals personal information about the user's location, which is a privacy concern. The comment could be made safer by not including the user's location in the comment.","To protect the user's privacy, the comment should be modified to say something like ""We love spending our summer breaks at this beautiful park. Please don't share our location with anyone."" This suggestion would be more effective in preventing the violation of the ""routines"" type."
