comment,category,score,reason,suggestion
"that looks like the 7th & oak mural, right?",location/geoinformation,7,"The comment ""That looks like the 7th & Oak mural, right?"" violates the ""location/geoinformation"" violation type due to the mention of a specific location (7th & Oak) and the use of the word ""mural"". The risk associated with this violation is that the comment may reveal the location of the mural, which could potentially compromise the user's privacy.","To protect the user's privacy, the comment should be edited to remove any mention of the mural or any specific location. The user should be encouraged to avoid posting comments that could potentially reveal their location or any other personal information."
omg u filmed right by city library lol,location/geoinformation,6,"The comment ""omg u filmed right by city library lol"" violates the location/geoinformation violation type because it reveals the physical location of a public space, such as a library, which can be a privacy concern. To make the comment safer, the user should avoid posting comments about public spaces or locations that could reveal their physical location.","To make the comment safer, the user should avoid posting comments about public spaces or locations that could reveal their physical location. They should instead use hashtags or descriptive language that does not reveal their physical location. For example, they could use a hashtag like #library or #libraryroom to indicate the location, or they could describe the space in more detail, such as ""this is the library at [city name]."""
saw that sign in my hood yesterday ðŸ˜‚,location/geoinformation,6,"The comment violates the location/geoinformation violation type because it describes a physical location, such as a street or building, rather than a virtual location, such as a website or app. The specific risk is that the comment could reveal the user's physical location to others, which could be a privacy concern.","To protect the user's privacy, the comment could be rephrased as ""I saw that sign in my neighborhood yesterday ðŸ˜Š"" or ""I saw that sign in my hood ðŸ˜Ž"". This would avoid revealing the user's physical location and instead emphasize the context of the sighting."
walk past here every morning on my way to class,routines,7,"The comment violates the 'routines' violation type because it includes information about the user's daily routine, which can be easily traced and used to identify other users who share similar routines. The comment also violates the 'contactinfo' violation type because it includes information about the user's personal contacts, which can be used to identify other users with similar personal contacts.","To make the comment safer, the user should avoid sharing personal information, such as his phone number or address, in public places like this. He can also consider using a different route to avoid walking past this location every morning."
damn this my bus stop too ðŸ˜…,location/geoinformation,7,"The comment violates the location/geoinformation violation type because it suggests that the user is using a public bus stop as a private location. This could potentially reveal their location to others, which could be a privacy concern.","To avoid this risk, the user should avoid using public bus stops as a private location, or use a private location that is not easily accessible to others."
isn't that Lacey's Mall food court?,location/geoinformation,5,"The comment ""isn't that Lacey's Mall food court?"" violates the ""location/geoinformation"" violation type, which means that the comment contains information about a specific location. Focus on the specific risk that this information poses to the user's privacy: ""The comment mentions a specific location, which could reveal personal information such as the user's address, phone number, or other sensitive data.""","The comment could be made safer by including a disclaimer that reads: ""Note that this comment does not reveal any personal information about the user. However, it may still be considered a violation of the 'location/geoinformation' violation type."""
yo that's def union square in the bg,location/geoinformation,6,"The comment's location information is visible to anyone who knows the user's location, which could potentially expose their personal information to unauthorized access. Suggestion: Consider using a location-based service that anonymizes user data before sharing it publicly.",Consider using a location-based service that anonymizes user data before sharing it publicly.
used to live 2 blocks from this spot ðŸ˜­,location/geoinformation,7,"The comment violates the ""location/geoinformation"" violation type because it mentions the user's physical location, which can be a privacy concern. The specific risk is that the comment could reveal the user's location to others.","To protect the user's privacy, the comment could be phrased as follows: ""I used to live 2 blocks from this spot, but I'm not sure if it's still open. If you're looking for a great spot to grab a bite to eat, I'd recommend checking out [insert name of another nearby restaurant or cafe]."" This suggestion suggests that the user is looking for a different restaurant or cafe and avoids mentioning the user's physical location."
"green bench by the plaza, classic",location/geoinformation,5,"The comment ""green bench by the plaza, classic"" violates the ""location/geoinformation"" violation type because it contains information about the location of a bench, which is a sensitive information that could potentially reveal the user's location. The comment also contains the word ""classic,"" which is a common term used to describe a particular type of bench. This information could potentially identify the user and his preferences, which could be a privacy concern.","To make the comment safer, the user should avoid using sensitive information like location or bench type in comments. They could instead suggest a more private and discreet bench, or provide a more general comment about the plaza or its surroundings."
wait is this the new skatepark on Westside?,location/geoinformation,5,"The comment violates the location/geoinformation violation type because it suggests that the user is planning to visit a skatepark on Westside. This information could potentially reveal the user's location, which could be a privacy concern. Suggestion: Instead of suggesting that the user avoid visiting the skatepark on Westside, suggest that he avoid using public transportation or riding his bike to avoid revealing his location.","Instead of suggesting that the user avoid visiting the skatepark on Westside, suggest that he avoid using public transportation or riding his bike to avoid revealing his location."
my daily walk goes right past there,routines,7,"The comment ""my daily walk goes right past there"" violates the ""routines"" violation type because it reveals personal information about the user's daily routine. The comment could potentially reveal the user's location, which could be used for spying or other malicious purposes. To protect the user's privacy, the comment should be edited or removed to avoid violating this type.","To avoid this violation, the user should avoid posting comments that reveal their daily routine or location. They could consider using a different social media platform that does not share this information with third parties. They could also consider using a privacy-focused social media app that does not share their location with third parties."
refill my water there after my run lmao,routines,6,"The comment violates the ""routines"" violation type because it suggests that the user is using public water fountains or tap water for refilling his water bottle after a run. Focus on the specific risk of exposing personal information to others.","The comment could be made safer by using a private water fountain or tap water, or by asking the user to refill his water bottle at a private location or at home. This could help protect his privacy and avoid potential privacy violations."
"rexall's pharmacy in the corner, recognize it anywhere",location/geoinformation,5,"The comment violates the location/geoinformation violation type because it refers to a specific location, such as a pharmacy in the corner, which can be easily identified by anyone who knows the location. This can potentially expose the user's personal information to potential identity theft or other privacy concerns.","To avoid this risk, the user should avoid sharing personal information in comments that could be easily identified by others. This could include using generic names or locations, or using alternative phrasing that is less likely to reveal personal information."
bro we always hoop on this court too,routines,6,"The comment ""bro we always hoop on this court too"" violates the ""routines"" type because it reveals personal information about the user's activities on the basketball court. The comment is not only a breach of privacy but also a violation of the ""geolocation"" type, which requires users to specify their location when posting a comment.","To protect the user's privacy, the comment should be edited to remove any personal information or replace it with a generic statement, such as ""I'm just here to enjoy the game."" Alternatively, the user could choose to hide their location when posting a comment to protect their privacy."
"solid playground, my old afterschool spot",location/geoinformation,6,"The comment ""solid playground, my old afterschool spot"" violates the location/geoinformation violation type because it includes personal information such as the user's address or location. To make the comment safer, the user should avoid sharing this information on social media platforms.","To make the comment safer, the user should avoid sharing his address or location on social media platforms. He should consider using a different location identifier or using a location-based service that does not collect or share personal information."
i get off at this station every day,routines,8,"The comment ""i get off at this station every day"" violates the ""routines"" type because it reveals personal information such as the user's location. The comment could be made safer by using a location-based service instead of posting the exact location. This would prevent the user's location from being visible to others.","Instead of posting the exact location, the user could use a location-based service like Google Maps or Waze to indicate their current location. This would help protect their privacy by obscuring their actual location."
"lol my street, literally see my bike rack",location/geoinformation,9,"The comment ""lol my street, literally see my bike rack"" violates the location/geoinformation violation type because it reveals the user's physical location, which can be a privacy concern. The comment suggests that the user should avoid posting such information on social media platforms.","To protect his privacy, the user should consider posting a different image or location instead of his bike rack. He could also consider using a privacy-focused social media platform that does not share his physical location with third parties."
seen this mural while waiting for my rideshare,location/geoinformation,5,"The comment ""seen this mural while waiting for my rideshare"" violates the location/geoinformation violation type because it reveals the location of a person or place, which can be easily traced and used for identity theft or other criminal activities. To be safe, the user should avoid posting such information on social media platforms.","To protect his privacy, the user should avoid posting information about his location, such as his address or the name of his rideshare company, on social media platforms. He should also consider using a different social media account or platform for sharing such information."
apartment w/ the red door right,location/geoinformation,7,"The comment ""apartment w/ the red door right"" violates the location/geoinformation violation type because it reveals the physical location of an apartment, which can be a privacy concern. The comment could be made more safe by using a different wording or by adding a disclaimer that the location is not the actual address of the apartment.","To protect the user's privacy, the comment could be rephrased as ""the red door is located at the corner of the street"" or ""the apartment is located at the corner of the street"". This would make it clear that the comment is not referring to the actual address of the apartment. Additionally, the comment could be accompanied by a disclaimer that the user should avoid using the red door as a reference to the actual address of the apartment."
"can't believe u at pine&4th, memories",location/geoinformation,6,"The comment ""can't believe u at pine&4th, memories"" violates the location/geoinformation violation type because it reveals the user's physical location, which is a sensitive personal information. The comment also raises concerns about privacy, as it could potentially reveal the user's whereabouts to third parties.","To protect the user's privacy, the comment should be edited to remove any mention of the user's physical location. The user should be encouraged to avoid posting sensitive information about their location in the future."
literally in my backyard lmaoo,location/geoinformation,8,"The comment ""literally in my backyard lmaoo"" violates the location/geoinformation violation type because it reveals a user's physical location, which is considered sensitive information under the GDPR. The comment could be suggested to avoid posting personal information that could reveal one's location, such as ""in my backyard"" or ""at home"".","Instead of posting ""literally in my backyard lmaoo"", the user could consider posting a more private and descriptive comment, such as ""in my backyard, surrounded by trees and a small pond"" or ""at home, surrounded by my pets and a cozy living room"". This would help protect the user's privacy and avoid revealing their physical location."
this park is where I walk my dog every morning,routines,8,"The comment violates the location/geoinformation violation type because it includes the user's physical location, which can be a privacy concern.","To protect the user's privacy, the comment could be modified to avoid mentioning the user's physical location, such as ""I love walking my dog in this park every morning."""
whoa u showing off elm st again,location/geoinformation,6,"The comment violates the ""location/geoinformation"" violation type because it includes personal information such as the user's address or location. This information can be used by third parties to track the user's movements and behavior. To protect their privacy, the user should avoid sharing this information in public comments or posts.","To make the comment safer, the user should avoid sharing their address or location in public comments or posts. They could consider using a pseudonym or a different location to avoid being identified. They could also consider using a location-based service that encrypts their location data and anonymizes their location data when sharing it with others."
dude i go running past this bridge daily,routines,7,"The comment ""dude i go running past this bridge daily"" violates the ""routines"" violation type because it suggests that the user is engaging in a routine activity that is not necessary for his well-being or personal safety. This can be a privacy concern as it may reveal his location or other personal information. Suggestion: To protect his privacy, the user should avoid posting comments that suggest he is engaging in a routine activity. For example, he could use a different location or avoid posting comments that mention specific locations.","Reasoning: The comment ""dude i go running past this bridge daily"" violates the ""routines"" violation type because it suggests that the user is engaging in a routine activity that is not necessary for his well-being or personal safety. This can be a privacy concern as it may reveal his location or other personal information. Suggestion: To protect his privacy, the user should avoid posting comments that suggest he is engaging in a routine activity. For example, he could use a different location or avoid posting comments that mention specific locations."
my old flat used to face this street,location/geoinformation,6,The comment violates the location/geoinformation violation type because it suggests that the commenter's old flat used to face the street. This information could potentially reveal the location of the commenter's home or other personal information.,"To avoid this risk, the commenter could consider not including any information about their home or other personal details in their comment. This would help to protect their privacy and prevent any potential harm from being revealed."
recognize that pizza spot anywhere,location/geoinformation,5,"The comment violates the location/geoinformation violation type because it suggests that the user is sharing his location with the pizza spot. This could potentially reveal his physical location to the pizza spot, which could be a privacy concern.","To avoid this risk, the user could consider sharing his location only when he's at the pizza spot, or by using a location-based service like Google Maps or Waze. This would ensure that his location is only shared with the pizza spot and not with other users."
yo we hit up this spot on friday nights too,routines,7,"The comment violates the ""routines"" type because it suggests that the user visited a location on Friday nights, which is a time when many people are likely to be out and about. This could potentially expose the user's location to potential privacy risks.","To protect the user's privacy, the comment could be reworded to say something like: ""We hit up this spot on Friday nights, but be aware that it's not a good idea to share your location with everyone online."" This suggestion would emphasize the importance of privacy and encourage the user to avoid sharing their location with others."
i chill at that bus stop after practice,routines,8,"The comment violates the location/geoinformation violation type because it includes information about the user's location, which could potentially reveal their real-world location to others. To make the comment safer, the user should avoid posting information about their location in public places or on social media platforms.","To protect their privacy, the user could consider posting their location information in a more secure and private way, such as by using a GPS-enabled app or a location-based service. They could also consider using a pseudonym or anonymizing their location information in the comment."
haha my schoolâ€™s right round that corner,location/geoinformation,8,"The comment ""haha my schoolâ€™s right round that corner"" violates the location/geoinformation violation type because it reveals the location of the commenter's school. The specific risk is that the commenter's location can be traced back to their school, which can lead to privacy concerns.","To make the comment safer, the user should avoid sharing their school's location in public forums or social media platforms. They can also consider using a pseudonym or anonymizing their location information if necessary."
is that the laundromat on glen ave?,location/geoinformation,6,"The comment ""is that the laundromat on glen ave?"" violates the location/geoinformation violation type because it suggests that the user's location is being shared with others. Focusing on the specific risk, this comment could potentially expose the user's physical location to others.","To protect the user's privacy, the comment could be reworded to say ""I'm not sure if the laundromat on Glen Ave is open or closed at the moment."" This suggestion suggests that the user should avoid sharing personal information that could be used to identify the location of the laundromat."
was just there yesterday lol,location/geoinformation,5,"The comment ""was just there yesterday lol"" violates the ""location/geoinformation"" violation type because it reveals the user's location, which is a sensitive information. The specific risk is privacy concern, as the comment suggests that the user is revealing his location to the world.","To protect his privacy, the user should avoid posting sensitive information about his location on social media platforms. He should consider using a private messaging app or a location-based service that does not store his location data."
my friend lives on that block,location/geoinformation,5,"The comment violates the location/geoinformation violation type because it suggests that the user's friend's address is located on a specific block. Focus on the specific risk that this information poses to the user's privacy, such as revealing their location or contact information.","To make the comment safer, the user should avoid sharing their friend's address on social media platforms, as it could potentially reveal their location and contact information. They should consider using a different platform or location-based app to share this information."
bumped into u there once,location/geoinformation,4,"The comment ""bumped into u there once"" violates the location/geoinformation violation type because it reveals the user's physical location, which can be used to identify him or her. The comment could be made more safe by using a location-based hashtag or using a GPS-tracking app to anonymize the user's location.","To protect the user's privacy, the comment could be made more safe by using a location-based hashtag or anonymizing the user's location by using a GPS-tracking app. The user could also consider using a pseudonym or a different username to protect their identity."
passed that statue during my jog today,routines,6,"The comment violates the ""routines"" violation type because it includes information about a physical location, which can be a privacy concern. To be safe, the user should avoid posting information about their physical location on social media.","To protect their privacy, the user should consider posting information about their physical location only when they are actively exercising, such as during a run or a bike ride. They should also consider using a location-based app to track their movements and avoid posting information about their physical location during non-exercise times."
same route home from work every day,routines,7,"The comment ""same route home from work every day"" violates the ""routines"" type due to the fact that it reveals the user's daily commute route. This information can be used by hackers to track the user's movements and potentially gain access to sensitive information. To protect the user's privacy, the comment should be flagged with a ""privacy"" violation type and suggested that the user avoid sharing this information in the future.","Instead of sharing their daily commute route, the user could consider using public transportation or carpooling with friends or family members. This would help to protect their privacy while still getting where they need to go."
literally where i eat lunch after chem,routines,6,"The comment ""literally where I eat lunch after chem"" violates the ""routines"" type because it reveals personal information about the user's lunch destination. The comment is not only a violation of the type but also a breach of the user's privacy as it reveals his location to others.","The user should avoid posting comments that reveal his location, as it can be a privacy concern. He should instead choose a location that is not easily identifiable, such as a public park or a nearby street."
isnâ€™t this next to kingâ€™s cafe?,location/geoinformation,5,"The comment ""isnâ€™t this next to kingâ€™s cafe?"", which is flagged with a violation type of ""location/geoinformation"", violates the privacy concern of the user. A single short sentence explaining why the comment violates the type is provided.","The comment ""isnâ€™t this next to kingâ€™s cafe?"", which is flagged with a violation type of ""location/geoinformation"", should be avoided to protect the user's privacy. A single short sentence suggesting how the comment could be safer or what the user should avoid to protect his privacy is provided."
always see that mural after the gym,routines,5,"The comment violates the ""routines"" violation type because it suggests that the user is sharing personal information about his gym routine with the comment. This could potentially expose his personal information to others, including strangers or people he doesn't know. To be safe, the user should avoid sharing this information in public forums or social media platforms.","To protect his privacy, the user should consider the following:"
this ur go to ice cream spot too?,location/geoinformation,5,"The comment violates the ""location/geoinformation"" violation type because it suggests that the user is sharing his location or geolocation information with a third party. This information can be easily accessed by the third party and could potentially be used to track the user's location or behavior. To protect the user's privacy, it's recommended to avoid sharing this information in public comments or posts.","To avoid sharing this information, the user can: - Use a private or encrypted comment or post to share their location or geolocation information. - Only share this information if they are sure that the third party is trustworthy and will not misuse it. - Consider using a third-party app or service that protects their privacy and location data."
