comment,category,score,reason,suggestion
catch me at that 24hr market,routines,5,"The comment ""catch me at that 24hr market"" violates the ""routines"" type because it suggests that the user is likely to be in a public place at a specific time, which could potentially expose his personal information to potential hackers or other unauthorized individuals. The comment could be made more safe by using a password or other form of encryption to protect the user's personal information.","To protect the user's privacy, the comment could be rephrased as ""I'll be at the 24hr market, so don't worry about me."" This would emphasize that the user is not in a public place and that his personal information is not being shared with anyone. The suggestion could also include a reminder to use caution when using public Wi-Fi or other unsecured networks."
lol same mailbox as mine,location/geoinformation,7,"The comment violates the ""location/geoinformation"" violation type because it reveals the user's physical location, which can be a privacy concern. The suggestion suggests how the user can protect his privacy by not posting his physical location in public forums or social media platforms.","Do not post your physical location in public forums or social media platforms. Instead, use location-based services like Google Maps or Waze to find your current location and share it only when necessary."
my fav view on my morning walk,routines,6,"The comment ""my fav view on my morning walk"" violates the type of ""routines"" because it reveals personal information about the user's daily routine. This information could be used to identify the user and his/her movements, which could be a privacy concern. Suggestion: To protect the user's privacy, the comment could be reworded to say something like ""looking out the window at my favorite view on my morning walk"" or ""watching the sunrise from my favorite spot on my morning walk."" This would avoid revealing personal information and still convey the same sentiment.","To protect the user's privacy, the comment could be reworded to say something like ""looking out the window at my favorite view on my morning walk"" or ""watching the sunrise from my favorite spot on my morning walk."" This would avoid revealing personal information and still convey the same sentiment."
our go-to lunch spot after tues lectures,routines,7,"The comment violates the ""routines"" type because it suggests that the user's location is being shared with others. This could potentially expose personal information, such as their address or phone number. Suggestion: The comment could be reworded to suggest that the user prefers to have a more private lunch experience, such as ordering takeout or eating at a restaurant that does not share their location with others. This would help to protect their privacy and prevent any potential privacy breaches.","The comment could be reworded to suggest that the user prefers to have a more private lunch experience, such as ordering takeout or eating at a restaurant that does not share their location with others. This would help to protect their privacy and prevent any potential privacy breaches."
this is right near the dog grooming place,location/geoinformation,4,"The comment ""this is right near the dog grooming place"" violates the location/geoinformation violation type because it reveals the user's location, which can be a privacy concern. The comment ""privacy concerns"" suggests that the user is concerned about his privacy, which could also be a risk.","The comment ""avoid this area"" suggests that the user should avoid going to the dog grooming place, which could help protect his privacy. The comment ""contact information"" suggests that the user should avoid sharing his contact information with others, which could also be a privacy concern."
lol u showing off the west end bridge too,location/geoinformation,6,"The comment ""lol u showing off the west end bridge too"" violates the location/geoinformation violation type because it reveals the location of a public space, which is not meant to be shared or advertised. The comment also raises concerns about privacy, as it could potentially reveal the user's location to others.","To protect the user's privacy, the comment could be reworded to say something like ""I'm not showing off the west end bridge, but I'm just curious about what's happening there!"" or ""I'm not showing off the west end bridge, but I'm just curious about the people who are using it!"" This suggestion would suggest that the user is not interested in advertising the location or sharing personal information, and instead is simply curious about what's happening at the bridge."
used to cut thru that alley to HS,routines,7,"The comment ""used to cut thru that alley to HS"" violates the ""routines"" type because it reveals personal information about the user's location. This information could be used by others to track their movements or identify them. To protect their privacy, the user should avoid posting information about their location or other personal details on social media.",The user should consider posting a different location or avoiding sharing their actual address or other personal details on social media. They should also consider using privacy-focused social media platforms that prioritize user privacy.
wow parking lot by my office,location/geoinformation,7,The comment violates the location/geoinformation violation type because it includes information about the parking lot where the user works. This information could potentially be used to identify the user's location or other personal information.,"To protect the user's privacy, the comment could be phrased as follows: ""I appreciate your workplace's efforts to provide a safe and secure environment for employees. However, I'm concerned about the information you've shared about the parking lot. Please ensure that any information you share is confidential and doesn't include my personal details."""
bg photo of my apt come on,location/geoinformation,9,"The comment ""bg photo of my apt come on"" violates the location/geoinformation violation type due to the fact that it discloses the physical location of the user's apartment. This information can be used to identify the user and potentially compromise his privacy. To be safe, the user should avoid posting photos of their apartment on social media platforms.","To protect his privacy, the user should avoid posting photos of their apartment on social media platforms. He should instead share photos of their home or other private locations that do not reveal their physical location."
just moved outta that street,location/geoinformation,6,"The comment ""just moved out of that street"" violates the location/geoinformation violation type because it reveals the user's current location. The specific risk is that the comment could reveal the user's current location to others, which can be a privacy concern.","To protect the user's privacy, the comment should be edited to remove any mention of the user's current location. For example, the comment could be edited to say ""I'm moving to a new neighborhood"" or ""I'm leaving my old neighborhood behind."""
walk that block every sunday for groceries,routines,7,"The comment ""walk that block every sunday for groceries"" violates the type of location/geoinformation because it reveals the user's physical location to others. This information can be used by criminals to locate the user's location and target him/her. To protect one's privacy, it is recommended to avoid posting such information on social media platforms.","To avoid revealing one's physical location, it is recommended to avoid posting such information on social media platforms. Users should instead use privacy-focused social media platforms or apps that prioritize privacy and security."
sat here for lunch every day last summer,routines,8,"The comment ""sat here for lunch every day last summer"" violates the ""routines"" type because it contains information about the user's location, which can be used to identify him. To protect his privacy, the user should avoid posting such information on social media.","To avoid being identified by his location, the user should avoid posting photos or videos of himself in public places, such as beaches or parks. He could also consider using a different username or disabling location tracking on his device."
grandma lives next door to this,location/geoinformation,8,"The comment violates the location/geoinformation violation type because it includes information about the location of a person or place, which can be a privacy concern. Suggestion: To protect your privacy, you should avoid including any personal information or location details in your comments. For example, you could use a different username or comment with a different location.","To protect your privacy, you should avoid including any personal information or location details in your comments. For example, you could use a different username or comment with a different location."
wait do u live in 306 building?,location/geoinformation,8,"The comment violates the location/geoinformation violation type because it includes information about the user's physical location, which could potentially reveal his or her private information.","To protect one's privacy, it is recommended to avoid posting information about one's physical location on social media platforms. The user should avoid sharing sensitive information such as address, phone number, or other personal details."
is that the river trail entrance?,location/geoinformation,6,"The comment ""is that the river trail entrance?"" violates the ""location/geoinformation"" violation type because it suggests that the user is accessing a specific location or information about a specific location. The specific risk is that the user's location or information could be exposed to others.","To protect the user's privacy, the comment should be reworded to avoid mentioning the specific location or information. For example, ""Would you mind not mentioning the name of the river trail entrance?"" or ""Can you please refrain from mentioning the name of the river trail entrance?"""
bro this is broadway & 4th right,location/geoinformation,5,"The comment includes information about a location, which is a sensitive information that could be used to identify the user. To protect their privacy, the user should avoid posting information about their location on social media.","The comment suggests that the user avoid posting information about their location on social media, such as by using a location-based filter or by not sharing their exact location. This could help protect their privacy and prevent others from identifying them based on their location."
thereâ€™s my mailbox,location/geoinformation,8,"The comment violates the location/geoinformation violation type because it includes the address of the user's mailbox. This information can be easily accessed by others, potentially compromising their privacy. Suggestion: To protect their privacy, the user should avoid including their mailbox address in their posts or comments.","To protect their privacy, the user should avoid including their mailbox address in their posts or comments."
my bus always late at this stop,routines,7,"The comment ""my bus always late at this stop"" violates the type of ""routines"" because it reveals personal information about the user's travel schedule. The risk of this violation is high because it can reveal personal information to others, potentially leading to identity theft or other privacy concerns.","The user should avoid posting personal information about his travel schedule on social media platforms, especially in comments that are visible to the public. He can instead share his travel plans in a private message or email, or use a different platform that does not display his location or other personal information."
closest starbucks to my uni lol,location/geoinformation,6,"The comment violates the location/geoinformation violation type because it suggests that the user is searching for a specific location, such as a Starbucks, which is not a safe location for personal information to be shared. The suggestion provided by the tool is to avoid searching for Starbucks near the user's uni, as it could potentially expose their personal information.","Instead of searching for a specific location, the user can consider searching for nearby coffee shops or restaurants that are not on their uni campus. This would help protect their privacy and prevent any potential risks associated with sharing their personal information."
walk past that statue after club,routines,5,"The comment ""walk past that statue after club"" violates the ""routines"" type because it reveals personal information about the user's location, which is a privacy concern. The comment could be made safer by using a location-based service or by not posting personal information in public places.","If the user is concerned about privacy, he should avoid posting personal information in public places, such as on social media platforms. He could consider using a location-based service or choosing a less-public location for his post."
i used to practice violin there,routines,6,"The comment ""i used to practice violin there"" violates the ""routines"" violation type because it reveals personal information about the user's location. The user's location can be used to identify them, which could put them at risk of physical harm or other forms of harassment.",The user should avoid posting personal information about their location on social media platforms. They should consider using a virtual private network (VPN) to protect their privacy while using public Wi-Fi. They should also consider using a different social media platform if they want to practice violin in a public location.
used to sketch here after class,routines,5,"The comment ""used to sketch here after class"" violates the ""routines"" type due to the fact that it reveals personal information such as where the user is located or his routines. This information could potentially be used by others to track his movements or behavior. To protect his privacy, the user should avoid posting such information in public spaces.","To make the comment safer, the user should consider posting his routines in a more private location, such as his workspace or a public park. He should also consider using a pseudonym or anonymizing his location information to avoid revealing his true location."
thought that was my house for a sec,location/geoinformation,7,"The comment suggests that the user's house was briefly visible from the commenter's location, which is a privacy concern. The commenter should avoid posting comments that could reveal their location or home address.","To protect their privacy, the commenter should avoid posting comments that reveal their location or home address, such as ""I'm at home"" or ""I'm at my house."" They should also consider using a pseudonym or anonymizing their location information in the comment."
morning jog crew at this park,routines,6,"The comment ""morning jog crew at this park"" violates the ""routines"" type because it reveals the user's physical location and activities during the day. This information can be used by criminals to plan and execute attacks on the user. To protect his privacy, the user should avoid posting such information on social media platforms.","To avoid this risk, the user should avoid posting information about his physical location and activities during the day on social media platforms. He can consider using a location-based social media app or disabling the ""routines"" type in his profile settings."
skyline view from my kitchen window lol,location/geoinformation,8,"The comment ""skyline view from my kitchen window lol"" violates the ""location/geoinformation"" violation type, as it includes information about a specific location (i.e., my kitchen window) that is not publicly available. This information could potentially reveal my personal location and identity. To protect my privacy, I suggest avoiding comments that include location-specific information in the future.","To avoid this risk, I would recommend using a commenting system that does not allow users to post comments containing location-specific information, such as ""skyline view from my kitchen window lol"". This would prevent users from sharing information about their personal location with others."
meet up inside westfield mall every week,routines,7,"The comment ""meet up inside westfield mall every week"" violates the ""routines"" type due to the potential for the user's location to be shared with others. This type of information can be sensitive and should be treated with care. To suggest a safer option, the comment could be reworded to say ""meet up at a designated location within Westfield mall every week"" or ""meet up at a specific time and place within Westfield mall every week"". This would ensure that the user's location is not shared with others and protects their privacy.","""Meet up at a designated location within Westfield mall every week, and be sure to arrive early to avoid any crowds."" This suggestion would help to ensure that the user's location is not shared with others, while also providing a safe and convenient location for the meeting."
"guess this the path home, huh",routines,6,"The comment suggests that the user is traveling home, which is a privacy concern. The comment violates the ""routines"" violation type because it suggests that the user is sharing his location or routines with others.","The comment suggests that the user should avoid sharing his location or routines with others, as it could potentially reveal personal information that could be used for identity theft or other criminal activities. The comment also suggests that the user should consider using a different transportation method or avoiding public transportation altogether."
walked here after my exams yesterday,routines,6,"The comment violates the ""routines"" violation type because it reveals personal information such as the user's location, which can be easily accessed by others. To protect his privacy, the user should avoid posting such information on social media platforms.","To avoid revealing personal information on social media platforms, the user should avoid posting location-based information, such as his current location, or sharing his routines, such as his exercise routine or meal plans. He should also consider using privacy-focused social media platforms that prioritize user privacy."
used to take that tunnel after dark,routines,8,"The comment ""used to take that tunnel after dark"" violates the ""routines"" type because it reveals personal information about the user's habits and activities. The user should avoid posting such information in public spaces, as it can be easily accessed by others.","To protect his privacy, the user should avoid taking public transportation or using public spaces after dark, as this could expose his location and activities to others. He should also consider using a private tunnel or other secure means of transportation to avoid being tracked by others."
track team starts and ends here,routines,7,"The comment ""track team starts and ends here"" violates the ""routines"" type because it reveals personal information about the user's location, such as the start and end points of a workout or activity. This information can be used by others to track the user's movements or behavior, which can be a privacy concern.","To protect the user's privacy, the comment could be reworded to say something like ""start and end of workout at this location"" or ""location of workout at this time."" This would suggest that the user is engaged in a specific activity or location, rather than their location as a whole."
always cross at this stoplight after work,routines,7,"The comment ""always cross at this stoplight after work"" violates the ""routines"" type because it reveals the user's personal information, such as his work schedule, which could be used by cybercriminals to target him with phishing or other malicious attacks. The comment could also expose the user to potential legal liability if he were to be accused of committing a crime while crossing the stoplight.",The user should avoid crossing the stoplight at this location after work by using an alternative route or finding a different time to cross. He should also consider using a public transportation option or finding a parking spot in a safe area.
bet this the park u bring ur dog to on weekends,routines,5,"A single short sentence explaining why the comment violates the ""routines"" violation type. Focus on the specific risk and privacy concern.",A single short sentence suggesting how the comment could be safer or what the user should avoid to protect his privacy.
my subway line runs under this street,location/geoinformation,6,"The comment suggests that the user's subway line runs under a street, which is a privacy concern. The comment violates the type ""location/geoinformation"" and the risk score is 6.","The comment suggests that the user avoids walking or riding on the subway line that runs under the street, as it could potentially reveal his location to others. This could help protect his privacy."
literally my neighbor in this tiktok lol,location/geoinformation,8,"The comment ""literally my neighbor in this tiktok lol"" violates the ""location/geoinformation"" violation type due to the potential risk of revealing the user's physical location to their neighbor. To be safe, the user should avoid posting this type of comment in public spaces.","To protect their privacy, the user should consider posting comments that are less personal or revealing, such as ""I'm having a great time at this tiktok party!"" or ""I'm so happy to see you, my friend!"""
just saw that street sign on my walk,location/geoinformation,5,"The comment ""just saw that street sign on my walk"" violates the location/geoinformation violation type because it reveals the user's physical location, which can be a privacy concern. To avoid this risk, the user should avoid posting comments that reveal their physical location.","To protect your privacy, you can use a location-based app or filter your posts to only include information that is not related to your physical location. For example, you could use a GPS-enabled app to only post location-based comments or use a filter that only shows posts from locations you have visited."
my new place two houses down,location/geoinformation,7,"The comment violates the location/geoinformation violation type because it includes information about the user's physical location, which could potentially reveal their personal information to others. Focus on the specific risk: Privacy concerns.","To avoid this risk, the user should avoid sharing personal information about their physical location or any other sensitive information in public places, such as on social media. This could include avoiding posting photos of their home or neighborhood, using location-based services like Foursquare or Flickr, and only sharing publicly visible information like street addresses or phone numbers."
ur porch view looks just like mine,location/geoinformation,7,"The comment ""ur porch view looks just like mine"" violates the location/geoinformation violation type because it reveals the user's physical location, which is a privacy concern. The comment could be made safer by not including personal information, such as the user's name or address.","Instead of sharing a physical location, the user could share a virtual tour of his home or a photo of his porch. This would protect his privacy while still allowing others to see his home's exterior."
spot where I always lose my umbrella,routines,5,"The comment violates the ""routines"" violation type because it suggests that the user's location is being shared with others. This can be a privacy concern, as other users may be able to track the user's movements. To avoid this risk, the user should avoid posting location-based information on social media platforms.","To protect his privacy, the user should consider posting location-less information or using a different social media platform that does not share user location with others."
bet u filmed on jefferson ave,location/geoinformation,5,"The comment ""bet u filmed on Jefferson Avenue"" violates the location/geoinformation violation type because it contains information about a specific location, which can be easily traced back to the user's physical address. The risk associated with this violation is that the user's location can be easily traced and used to identify him. Suggestion: To avoid this risk, the user should avoid posting information about his physical location on social media platforms.","To avoid this risk, the user should avoid posting information about his physical location on social media platforms."
canâ€™t believe you filmed down my block,location/geoinformation,8,"The comment ""canâ€™t believe you filmed down my block"" violates the location/geoinformation violation type because it reveals personal information about the user's location, which is a privacy concern. The comment also highlights the user's frustration with the filming of their block, which could potentially lead to a violation of their privacy.","The user could avoid posting comments that reveal their location or other personal information, such as their street address or phone number, to protect their privacy. They could also consider using a different social media platform that does not have the same level of privacy concerns."
