comment,category,score,reason,suggestion
train platform 4 every morning,routines,7,"The comment ""train platform 4 every morning"" violates the ""routines"" type because it includes information about the user's personal travel schedule, which could be used to identify him or her. The comment could also be seen as a potential invasion of privacy, as it could reveal sensitive information about the user's daily routines.","To protect the user's privacy, the comment could be edited to remove any information about his or her travel schedule or replaced with a generic statement such as ""train platform 4 every morning."" The user could also consider using a different social media platform that does not share personal information with third parties."
always catch the 7am express,routines,8,"The comment violates the ""routines"" violation type because it suggests that the user is always traveling to work by train at 7am. This is a privacy concern as it could reveal the user's location to others.","To avoid this risk, the user should avoid traveling to work by train at 7am, as this is not a routine activity. They could instead take public transportation or use a different mode of transportation to reach their destination."
post-gym smoothie here everyday,routines,6,"The comment ""post-gym smoothie here everyday"" violates the ""routines"" violation type because it includes information about the user's physical location, which can be considered a privacy concern. Focus on the specific risk and privacy concern: ""This comment violates the 'routines' violation type because it includes information about the user's physical location, which can be considered a privacy concern.""","To protect the user's privacy, the comment should be reworded to avoid mentioning the user's physical location, such as ""I had a great workout today and wanted to share my smoothie recipe with you."" This would avoid violating the ""routines"" violation type and instead focus on the health benefits of the smoothie."
ur always at the park 7pm,routines,6,"The comment ""ur always at the park 7pm"" violates the ""routines"" type because it reveals personal information about the user's location at a specific time. This information can be easily accessed by others, which can pose a privacy concern. The suggestion is to avoid posting location-specific information in public spaces, such as in comments or social media posts.","Instead of posting location-specific information, the user should consider posting a general location, such as ""I'm at the park tonight at 7 pm,"" or using a location-based app that encrypts and anonymizes user data."
ya'll eating there every monday night,routines,5,"The comment ""ya'll eating there every Monday night"" violates the ""routines"" type because it reveals personal information such as the user's location, which can be used to identify him or her. To protect his privacy, the user should avoid posting such information on social media.","To avoid this risk, the user should consider posting information about his or her preferred meal times or other activities that are not related to his or her location. This would help to protect his or her privacy and prevent others from identifying him or her based on his or her location."
same time same bus every monday,routines,7,"The comment ""same time same bus every Monday"" violates the type of ""routines"" because it reveals personal information about the user's schedule. The user should avoid posting such information on social media platforms.","The user should avoid posting information about his schedule on social media platforms, as it can be easily accessed by others and can potentially violate his privacy. He should consider using a different platform for sharing such information."
catch me here every lunch break,routines,6,"The comment violates the ""routines"" violation type because it suggests that the user is leaving his workplace at a specific time every day, which could be a privacy concern. Focus on the specific risk associated with this violation type: ""Leaving workplace at a specific time every day.""","To protect his privacy, the user should avoid leaving his workplace at a specific time every day, as it could reveal his location and potentially compromise his security. Here's a suggestion: ""If you must leave your workplace at a specific time every day, consider taking public transportation or using a private car to avoid leaving your workplace at a specific time."""
bike ride at sunset every day,routines,6,"The comment ""bike ride at sunset every day"" violates the ""routines"" type due to the mention of a specific location (i.e., ""every day"") and the potential for the user's location to be revealed. The comment could be made safer by not including the user's location in the comment or by using a different location-specific phrase, such as ""bike ride at sunset in [specific city/region].""","The comment ""bike ride at sunset every day"" could be made safer by using a different phrase that does not reveal the user's location, such as ""bike ride at sunset in [specific location]."" This would help protect the user's privacy while still allowing them to enjoy their bike ride."
we hoop here saturday mornings,routines,5,"The comment ""we hoop here saturday mornings"" violates the type of ""routines"" because it includes personal information such as the user's location and routines. This information can be used to identify the user and potentially compromise their privacy. To make the comment safer, the user should avoid posting personal information in public forums or social media platforms.","To make the comment safer, the user should avoid posting personal information in public forums or social media platforms, especially when they are not actively using them. This includes things like their location, routines, and other personal information. Users should also consider using privacy-focused social media platforms or forums that prioritize user privacy."
all my tests done here lol,routines,5,"The comment ""all my tests done here lol"" violates the ""routines"" type due to the mention of personal information, such as the user's test results. The comment could be made safer by using a different form of address or by not sharing personal information in public.","To protect your privacy, consider using a different form of address or avoid sharing personal information in public. You can also consider using a test result privacy tool to ensure that your results are kept confidential."
see u at 8am jog as always,routines,7,"The comment ""see u at 8am jog as always"" violates the ""routines"" type due to the mention of jogging as a routine activity. The specific risk associated with this type is the potential for the user's location to be shared with others.","To protect the user's privacy, the comment could be reworded as ""I'll be running at 8am tomorrow, so don't worry about my whereabouts."" This suggestion suggests that the user will be running alone and not sharing his location with others."
library at 10 before class forever,routines,6,"The comment ""library at 10 before class forever"" violates the ""routines"" type because it contains information about the user's location, which is a privacy concern. The user should avoid posting information about his location on social media platforms.","To protect his privacy, the user should avoid posting information about his location on social media platforms. He could, for example, use a location-based app or a virtual private network (VPN) to hide his location."
train crowd at this hour man,routines,4,"The comment ""train crowd at this hour man"" violates the ""routines"" violation type due to the potential risk of the comment being shared with others, including the user's personal information. The comment could be made safer by avoiding sharing personal information or using a different location or routine.","To protect one's privacy, the user should avoid sharing personal information or using a routine that involves public transportation, such as a train, bus, or subway. They should also consider using a different location or routine that does not involve public transportation."
pass this field on my walk 2 school,routines,6,"The comment ""pass this field on my walk 2 school"" violates the ""routines"" type because it reveals personal information such as the user's location or routines. The comment could be made safer by using a hashtag or a different location identifier, such as ""walking to school"" or ""running to school.""","To protect the user's privacy, the comment could be made safer by using a different location identifier or a hashtag, such as ""walking to school"" or ""running to school."" The user could also consider using a different social media platform that does not share their location or routines with third-party apps."
study crew same table always,routines,5,"The comment ""study crew same table always"" violates the ""routines"" type because it reveals personal information about the user's study routine, such as the table they study at or the specific times they study. This information can be used by others to identify the user and potentially compromise their privacy.","The user should avoid using public or shared study spaces, such as tables, chairs, or desks, and instead study in a private location such as a library or a room with a door. They should also avoid sharing their study routine with others, especially if they are not comfortable with doing so."
see u at the same starbucks daily,routines,4,"The comment ""see u at the same starbucks daily"" violates the ""routines"" type because it reveals personal information such as the user's location or routines. The comment could be made safer by using a hashtag or a location-based filter to prevent others from seeing the user's location.","To protect the user's privacy, the comment could be made safer by using a hashtag or a location-based filter to prevent others from seeing the user's location. The user should avoid posting comments that reveal personal information such as routines or location."
used to do my assignments here every thurs,routines,5,"The comment ""used to do my assignments here every thurs"" violates the ""routines"" type because it reveals personal information such as the user's schedule. This information can be used by others to track his movements or plan his schedule. To protect his privacy, the user should avoid posting such information on social media platforms.","To avoid this risk, the user should avoid sharing personal information on social media platforms, especially in the ""routines"" type. He can also consider using a different social media platform that does not share this information with third parties."
right after lunch we're always at that food cart,routines,6,"The comment ""right after lunch we're always at that food cart"" violates the ""routines"" type because it suggests that the user is always at a certain location, which could be a privacy concern. The comment could be made more safe by using phrases like ""we usually go to this food cart after lunch"" or ""we're always going to that food cart after lunch"".","To protect the user's privacy, the comment could be rephrased as ""we usually go to this food cart after lunch, and we're always there"". This suggestion would suggest that the user is not always at the food cart, and that they are aware of this."
"late lab sessions crew, every weds",routines,6,"The comment violates the ""routines"" violation type because it includes information about late lab sessions, which are a privacy concern. To avoid this risk, the user should avoid sharing personal information about his academic schedule on social media.","To protect his privacy, the user should avoid sharing information about his academic schedule on social media, such as his late lab sessions, in the future. This could include using social media platforms with fewer privacy settings or creating a separate account for academic purposes."
waiting for my friend at this corner daily,routines,5,"The comment violates the ""routines"" type because it reveals the location of the user's friend at a specific corner. This information can be easily accessible to others, and it could potentially compromise their privacy.","To avoid this risk, the user should avoid posting comments that reveal their location or any other personal information. They should also consider using a different location to post their comment, or consider using a location-based service to post their friend's location."
same gym squad every morning,routines,4,"- The comment violates the ""routines"" type because it suggests that the user is participating in the same gym squad every morning. This could be a privacy concern as it could reveal personal information about the user's gym routine.","- To avoid this violation, the user should consider creating a separate gym account or choosing a different gym location to avoid being identified by the same gym squad. This could also help protect their privacy and prevent any potential negative consequences. - Alternatively, the user could choose to not participate in the same gym squad every morning and instead opt for a different routine or location. This would help protect their privacy and avoid any potential negative consequences."
after school hang at this bench,routines,7,"The comment ""after school hang at this bench"" violates the ""routines"" type because it reveals the user's location and could potentially expose his personal information to others. The comment is also risky because it could encourage other users to follow the same route or hang out at the same location.","To protect the user's privacy, the comment could be reworded to say ""after school hangout at this bench"" or ""after school hangout at a nearby bench"". The comment should also include a disclaimer or warning to users about the potential risks of sharing their location and personal information."
quick snack stop after soccer,routines,6,"The comment includes a reference to a quick snack stop after soccer, which is a routine activity that can be easily tracked by the user's location. This can potentially expose the user's location to others who may be monitoring his location. To protect his privacy, the user should avoid posting comments that include location-based information.","To avoid exposing his location, the user should avoid posting comments that include location-based information, such as ""quick snack stop after soccer"" or ""going to the gym."" Instead, he should consider posting comments that are more general or private, such as ""going for a run"" or ""having a cup of coffee."""
always meet up on that park bench after class,routines,6,"The comment violates the ""routines"" violation type because it suggests that the user is meeting up with a specific location, which could potentially reveal his location to others. Focus on the specific risk of this violation type: the user's location could be revealed to others, potentially leading to privacy concerns.","To avoid this risk, the user should avoid meeting up with specific locations, such as the park bench, after class. This could be done by choosing a different location or by meeting up with a friend or family member instead."
walk home this way after work,routines,6,"The comment ""walk home this way after work"" violates the type of location/geoinformation because it reveals the user's exact location to others. This can be a privacy concern as it can be used to track the user's movements and location. To suggest a safer comment, the user should avoid using location-based information in their comments. Instead, they could mention a nearby park or public transportation station.","Instead of ""walk home this way after work,"" the user could say ""walk to the nearest park or public transportation station."" This suggestion would be more privacy-friendly and avoid revealing the user's exact location."
always line up here for school,routines,7,"The comment ""always line up here for school"" violates the ""routines"" type due to the potential for the user's location to be shared with others. This can potentially expose sensitive information such as the user's address or phone number. To ensure the comment is safe, the user should avoid sharing their location with others and consider using a different location-based service.","To protect the user's privacy, the comment should be phrased as ""I always line up at this specific location for school"" or ""I prefer to attend school at this specific location."" This way, the user's location is not shared with others and the comment is safer to post."
dorm cafeteria breakfast ritual,routines,5,"The comment violates the location/geoinformation violation type because it describes a specific location, such as the dorm cafeteria, where the user's personal information is likely to be shared. This information could be easily accessible to others and could potentially compromise the user's privacy. Suggestion: To avoid this risk, the user should avoid sharing personal information in public areas such as the dorm cafeteria, and instead, prefer to eat meals in private settings.","To avoid this risk, the user should avoid sharing personal information in public areas such as the dorm cafeteria, and instead, prefer to eat meals in private settings."
ride the 4pm train here every weekday,routines,7,"The comment suggests riding the 4pm train every weekday, which is a public transportation route that can be tracked by the government and other authorities. This information can be used to identify individuals or groups who are commuting to work or school, potentially exposing them to surveillance and other forms of monitoring. To protect one's privacy, it's recommended to avoid using this route or any other public transportation that could be monitored.","Instead of using the 4pm train every weekday, consider taking a different route or using a private mode of transportation, such as a taxi or ride-sharing service, to avoid being tracked by authorities."
8am class hustle on this street,routines,7,"The comment violates the ""routines"" violation type because it includes information about the user's location, which could be used to identify him. To protect his privacy, the user should avoid posting comments that include location information in the future.","To avoid this risk, the user should avoid posting comments that include location information in the future, such as during class or while commuting. He can also consider using a different location-based service or location-free mode in his social media apps."
always see the same people here after school,routines,5,"The comment violates the ""routines"" type because it reveals information about the user's location, which can be used to identify him or her. This information can be used for purposes such as stalking or harassment. To protect his privacy, the user should avoid posting information about his location on social media platforms.","To protect his privacy, the user should avoid posting information about his location on social media platforms, such as Facebook, Twitter, or Instagram. He should also consider using a privacy-focused social media app that does not share his location with third parties."
see you at the field for evening runs,routines,5,"The comment ""see you at the field for evening runs"" violates the ""routines"" type because it includes personal information such as the user's location, which could potentially be used for spying or other malicious purposes. To be safe, the user should avoid posting such information on social media platforms.","To protect his privacy, the user should consider posting his location only when he's actually going to be running in the field, and avoid sharing his location with anyone else. He should also consider using a different location-based app or service that doesn't share his location with anyone."
this where I grab lunch everyday,routines,6,"The comment ""this where I grab lunch everyday"" violates the ""routines"" type because it reveals personal information such as the user's location. The specific risk is that the comment could be used to identify the user's location and potentially lead to privacy violations.","The comment could be made more private by using a different location identifier, such as a GPS-based location tracking service, or by using a more secure location-based service such as a cell tower or Wi-Fi network. The user should also consider disabling location services on their device to prevent their location from being shared with others."
crazy every tuesday we're at the same spot,routines,5,"The comment ""crazy every Tuesday we're at the same spot"" violates the ""routines"" type because it reveals personal information about the user's location. The user should avoid posting such comments as it can potentially reveal their location to others.","The user should avoid posting comments that reveal their location, as it can potentially expose their personal information to others. They should instead choose a different location to post from or use a different location-based feature like GPS tracking."
homeroom squad here every morning lol,routines,6,"The comment ""homeroom squad here every morning lol"" violates the ""routines"" violation type because it reveals personal information such as the user's location or routines. Focus on the specific risk and privacy concern: ""homeroom squad here every morning lol"" reveals personal information that could be used to identify the user and potentially compromise his privacy.","To make the comment safer, the user should avoid sharing personal information such as his location or routines in public spaces, such as social media platforms. He should also consider using a different username or pseudonym to avoid revealing his routines."
same route to gym daily,routines,6,- The comment violates the type of 'routines' because it suggests that the user takes the same route to the gym every day. This can be a privacy concern as it can reveal the user's location and movements.,"- To avoid the privacy concern, the comment could be modified to say something like ""I usually go to the gym at the same time every day, but I'm flexible and can adjust my routine if needed."" This suggests that the user's routine is flexible and can be adapted to accommodate changes in his schedule."
"take out food after night classes, usual",routines,6,"The comment violates the ""routines"" violation type because it suggests that the user is taking out food after night classes, which could potentially reveal his or her schedule to others. This could be a privacy concern.","To avoid this risk, the user should consider taking out food before or after the night classes to avoid being identified. Alternatively, they could consider taking out food during the day when they are not attending classes."
always use this path after football,routines,6,"The comment violates the ""routines"" violation type because it suggests using a specific path after football. This path could potentially reveal personal information about the user, such as their location or routines. To avoid this risk, the user should avoid using this path after football.","To protect their privacy, the user should avoid using this path after football by using a different route or alternative path that is not associated with their football activities. This could include using a different street, park, or public transportation route."
rainy walk after club meetings every week,routines,5,"The comment ""rainy walk after club meetings every week"" violates the ""routines"" type because it describes a physical activity that is not part of the user's routine. The risk associated with this type of comment is that it could reveal personal information about the user, such as his or her location or activities.","The comment ""rainy walk after club meetings every week"" could be made safer by adding a disclaimer or a comment indicating that it is not a typical activity for the user. The user could also consider choosing a different comment type, such as ""rainy walk after club meetings every week, please."" This would indicate that the comment is not a typical activity and could help protect the user's privacy."
my 7:30am walk start point,routines,7,"The comment violates the ""routines"" violation type because it suggests that the user's 7:30am walk start point is being shared with others. This could potentially expose personal information, such as the user's location, to others.","To avoid exposing personal information, the user should avoid sharing his walk start point with others or using location-based services that share his location with others. He should also consider using a different route or alternative start point."
uni gang here every friday night,routines,5,"The comment ""uni gang here every friday night"" violates the ""routines"" type because it reveals personal information such as the user's location or contact information. This information can be used to track the user's movements and potentially lead to identity theft or other privacy breaches. To protect the user's privacy, they should avoid posting such information in public forums or social media platforms.","If the user is concerned about their privacy, they should consider posting their location or contact information only in private messages or direct messages with friends or family members. This will help protect their personal information and prevent others from accessing it."
